"acquired","bankruptcy","company","company_name","description","industry","ticker"
FALSE,FALSE,"LEIDOS HOLDINGS, INC. (LDOS)","Leidos Holdings, Inc.","Leidos provides surveillance and reconnaissance collection and processing systems, advanced sensors, command and control solutions, training systems, and cybersecurity solutions for the U.S. Department of Defense, the intelligence community, and other government customers. The company also provides Electronic Health Record systems for government and commercial hospitals, and offers industrial engineering services.","business services,IT services","LDOS"
FALSE,FALSE,"L BRANDS, INC. (LB)","L Brands, Inc.","L Brands is a specialty retailer that operates Victoria’s Secret, Bath & Body Works, and other brands.","retail","LB"
FALSE,FALSE,"LOEWS CORPORATION (L)","Loews Corporation","Loews is a holding company, whose subsidiaries include CNA Financial Corporation, a commercial property and casualty insurer, Diamond Offshore Drilling, Inc., an operator of offshore oil and gas drilling rigs, Boardwalk Pipeline Partners, LP, engaged in the transportation and storage of natural gas, and the Loews Hotels Holding Corporation, a hotel chain operator.","conglomerate,engineering and construction,energy,financial company,insurance","L"
FALSE,FALSE,"KANSAS CITY SOUTHERN (KSU)","Kansas City Southern","Kansas City Southern is a North American railroad operator.","transportation","KSU"
FALSE,FALSE,"KOHL'S CORPORATION (KSS)","Kohl'S Corporation","Kohl's operates department stores in the U.S., and the Kohls.com e-commerce website. The company sells apparel, footwear, accessories, beauty and home products.","retail","KSS"
TRUE,FALSE,"KRAFT FOODS GROUP, INC. (KRFT)","Kraft Foods Group, Inc.","Prior to its 2015 merger with Heinz, Kraft Foods was a worldwide consumer packaged food and beverage company that manufactured and marketed food and beverage products including cheese, meats, refreshment beverages, coffee, packaged dinners, refrigerated meals, and dressings, primarily in the United States and Canada.","consumer goods","KRFT"
FALSE,FALSE,"THE KROGER CO. (KR)","The Kroger Co.","Founded in 1883, Kroger operates retail food supermarkets under a variety of local banner names. Supermarkets are generally operated as combination food and drug stores, multi-department stores, marketplaces, or warehouses. The company also manufacture and process some of the food for sale in its stores.","retail","KR"
FALSE,TRUE,"EASTMAN KODAK COMPANY (KODK)","Eastman Kodak Company","Eastman Kodak primarily provides printing equipment, digital offset plates, and consumables to commercial print, direct mail, publishing and packaging industries. The company also licenses Kodak brands to third party consumer product manufacturers, and sells industrial and motion picture film.","consumer goods,equipment","KODK"
FALSE,FALSE,"THE COCA-COLA COMPANY (KO)","The Coca-Cola Company","The Coca-Cola Company is the world's largest beverage company. The company owns, licenses and markets a number of nonalcoholic beverage brands, primarily sparkling beverages, waters, juices, ready-to-drink teas and coffees, and energy and sports drinks.","consumer goods","KO"
FALSE,FALSE,"CARMAX, INC. (KMX)","Carmax, Inc.","CarMax is a U.S. based auto retailer. The company purchases and sells used vehicles, and arranges financing for its customers.","retail","KMX"
FALSE,FALSE,"KINDER MORGAN, INC. (KMI)","Kinder Morgan, Inc.","Kinder Morgan owns and operates pipelines and terminals that transport natural gas, oil, and petroleum products in North America.","energy,transportation","KMI"
FALSE,FALSE,"KIMBERLY-CLARK CORPORATION (KMB)","Kimberly-Clark Corporation","Kimberly-Clark provides personal care, consumer tissue and professional products under brands such as Huggies, Kotex, Kleenex, and Scott.","consumer goods,health care","KMB"
FALSE,FALSE,"KLA-TENCOR CORPORATION (KLAC)","Kla-Tencor Corporation","KLA-Tencor supplies process control and yield management solutions for the semiconductor and nanoelectronics industries. Company products are also used in other high technology industries, including the light emitting diode (LED) and data storage industries, as well as general materials research.","equipment,hardware","KLAC"
FALSE,FALSE,"KIMCO REALTY CORPORATION (KIM)","Kimco Realty Corporation","Kimco Realty is a self-administered real estate investment trust (""REIT"") that owns and operates open-air shopping centers.","real estate,REIT","KIM"
FALSE,FALSE,"THE KRAFT HEINZ COMPANY (KHC)","The Kraft Heinz Company","Kraft Heinz manufactures and markets food and beverages, including condiments and sauces, cheese and dairy, meals, meats, refreshment beverages, and coffee throughout the world, under brands including Heinz, Kraft, Oscar Mayer, Planters, Philadelphia, Velveeta, Lunchables, Maxwell House, Capri Sun, and Ore-Ida.","consumer goods","KHC"
TRUE,FALSE,"KING PHARMACEUTICALS, INC. (KG)","King Pharmaceuticals, Inc.","Acquired by Pfizer in 2010, King Pharmaceuticals was a pharmaceutical company developing pain medicines and hospital products for use in humans, and medicated feed additives and water-soluble therapeutics for use in poultry, cattle, and swine.","health care,pharmaceuticals","KG"
FALSE,FALSE,"KEYCORP (KEY)","Keycorp","KeyCorp provides retail and commercial banking, commercial leasing, investment management, consumer finance, commercial mortgage servicing, and investment banking products to individual, corporate, and institutional clients.","banking,financial company","KEY"
FALSE,FALSE,"KB HOME (KBH)","Kb Home","KB Home constructs and sells single-family residential homes, townhomes and condominiums in the U.S. The company also provides mortgage banking and insurance services to homebuyers.","engineering and construction","KBH"
TRUE,FALSE,"KATE SPADE & COMPANY (KATE)","Kate Spade & Company","Acquired by Coach in 2017, Kate Spade offered fashion and home products, distributed through department stores, specialty retail stores and e-commerce.","consumer goods","KATE"
FALSE,FALSE,"KELLOGG COMPANY (K)","Kellogg Company","Kellogg, founded in 1906, manufactures and markets ready-to-eat cereal and convenience foods.","consumer goods","K"
FALSE,FALSE,"NORDSTROM INC (JWN)","Nordstrom Inc","Founded in 1901, Nordstrom is a fashion retailer that operates stores in the U.S. and Canada, as well as Nordstrom.com and TrunkClub.com web sites.","retail","JWN"
FALSE,FALSE,"JPMORGAN CHASE & CO. (JPM)","Jpmorgan Chase & Co.","JPMorgan Chase is a global financial services firm that provides investment banking, financial services for consumers and small businesses, commercial banking, financial transaction processing and asset management.","banking,financial company","JPM"
TRUE,FALSE,"THE JONES GROUP INC. (JNY)","The Jones Group Inc.","Acquired by Sycamore Partners, a private equity firm in 2014, The Jones Group was a global designer, marketer and wholesaler of apparel, footwear, jeans, jewelry and handbag brands.","consumer goods,retail","JNY"
TRUE,FALSE,"JANUS CAPITAL GROUP INC. (JNS)","Janus Capital Group Inc.","Acquired by Henderson on 2017, Janus Capital provided investment management and administration services to financial advisors, individuals and institutional clients through mutual funds, separate accounts, other pooled investment vehicles, and exchange-traded products in the U.S. and internationally.","asset management,financial company","JNS"
FALSE,FALSE,"JUNIPER NETWORKS, INC. (JNPR)","Juniper Networks, Inc.","Juniper Networks makes routers, switches, security gateways and firewalls for network service providers, data centers, and enterprise networks.","hardware","JNPR"
FALSE,FALSE,"JOHNSON & JOHNSON (JNJ)","Johnson & Johnson","Johnson & Johnson is engaged in the research and development, manufacture and sale of a broad range of products in the health care field, including consumer products for baby care, oral care, skin care, and women’s health; pharmaceuticals; and medical devices. The company was incorporated in 1887.","consumer goods,health care,medical devices,pharmaceuticals","JNJ"
FALSE,FALSE,"JEFFERIES FINANCIAL GROUP (JEF)","Jefferies Financial Group","Jefferies Financial Group, formerly Leucadia National Corporation, operates a global investment banking firm and a merchant banking business.","conglomerate","JEF"
FALSE,FALSE,"JACOBS ENGINEERING GROUP INC. (JEC)","Jacobs Engineering Group Inc.","Jacobs provides technical, professional, and construction services to clients in the oil and gas, chemicals, technology, and government markets. Services include engineering, architecture, environmental, and similar services, process, scientific, and systems consulting, construction, and operations and maintenance.","engineering and construction","JEC"
FALSE,FALSE,"J. C. PENNEY COMPANY, INC. (JCP)","J. C. Penney Company, Inc.","Founded in 1902, JCPenney is a U.S. retailer operating department stores that sell family apparel and footwear, accessories, jewelry, beauty products and home furnishings.","retail","JCP"
FALSE,FALSE,"JOHNSON CONTROLS INTERNATIONAL PLC (JCI)","Johnson Controls International Plc","Johnson Controls was originally established in 1885. The company sells control systems and mechanical equipment for air-conditioning, refrigeration and commercial heating; electronic security systems and fire detection and suppression systems; and lead-acid automotive batteries.","equipment","JCI"
FALSE,FALSE,"JABIL CIRCUIT, INC. (JBL)","Jabil Circuit, Inc.","Jabil Circuit provides electronics design and production services, such as component selection and procurement, injection molding, metal, plastics, precision machining, automated assembly, product testing, and order fulfillment.","business services,hardware","JBL"
FALSE,FALSE,"J.B. HUNT TRANSPORT SERVICES, INC. (JBHT)","J.B. Hunt Transport Services, Inc.","The company is a North American provider of surface transportation of full-truckload containerized freight, typically utilizing its own trucking equipment and drivers, as well as arrangements with rail carriers. The company also provides customized freight movement, equipment, labor, and delivery services, typically under long-term contracts with customers.","transportation","JBHT"
TRUE,FALSE,"SUN MICROSYSTEMS, INC (JAVA)","Sun Microsystems, Inc","Acquired by Oracle Corporation in 2009, Sun Microsystems provided network computing solutions.","hardware","JAVA"
FALSE,FALSE,"INVESCO LTD. (IVZ)","Invesco Ltd.","Invesco is a global investment management firm that serves retail and institutional clients with a range of investment products that include mutual funds, exchange-traded funds, savings accounts, and separately managed accounts.","asset management,financial company","IVZ"
FALSE,FALSE,"ILLINOIS TOOL WORKS INC. (ITW)","Illinois Tool Works Inc.","Illinois Tool Works is a global diversified manufacturer of industrial products and equipment. The company provides plastic and metal components, fasteners and assemblies to automotive manufacturers, test and measurement equipment for electronic manufacturing, commercial food equipment such as warewashers, ovens, and refrigerators, welding and construction products, and adhesives and specialty fluids.","equipment,materials","ITW"
FALSE,FALSE,"ITT CORPORATION (ITT)","Itt Corporation","ITT manufacturers critical components, such as valves and pumps for the energy and industrial markets, and braking systems and shock absorbers for the transportation market.","equipment","ITT"
FALSE,FALSE,"GARTNER, INC. (IT)","Gartner, Inc.","Gartner provides IT research and advisory services.","business services","IT"
FALSE,FALSE,"INTUITIVE SURGICAL, INC. (ISRG)","Intuitive Surgical, Inc.","Intuitive designs, manufactures and markets da Vinci Surgical Systems  for minimally invasive surgery. The da Vinci Surgical System translates a surgeon’s natural hand movements, which are performed on instrument controls at a console, into corresponding micro-movements of instruments positioned inside the patient through small incisions.","medical devices","ISRG"
FALSE,FALSE,"IRON MOUNTAIN INCORPORATED (IRM)","Iron Mountain Incorporated","The company provides physical record and data backup storage, and information management services for businesses and government organizations to protect their information, comply with regulations, and be able to recover from disaster.","business services,real estate,REIT","IRM"
FALSE,FALSE,"INGERSOLL-RAND PLC (IR)","Ingersoll-Rand Plc","Ingersoll-Rand provides heating, ventilation, and air conditioning (HVAC) systems under the Trane, American Standard, and Thermo King brands. The company also provides compressed air and gas systems, power tools, material handling systems, and fluid management equipment, as well as golf, utility and rough terrain vehicles.","equipment","IR"
FALSE,FALSE,"IQVIA HOLDINGS INC. (IQV)","Iqvia Holdings Inc.","","pharmaceuticals, medical devices","IQV"
FALSE,FALSE,"THE INTERPUBLIC GROUP OF COMPANIES, INC. (IPG)","The Interpublic Group Of Companies, Inc.","Interpublic is a global advertising and marketing services company, providing consumer advertising, digital marketing, communications planning and media buying, and public relations services to local, regional, and global clients.","business services","IPG"
FALSE,FALSE,"INTERNATIONAL PAPER COMPANY (IP)","International Paper Company","International Paper is a global manufacturer of paper and packaging products, a successor to a business organized in 1898. The company operates pulp, paper and packaging mills, converting and packaging plants, and recycling plants. The company also owns and manages forestland.","materials","IP"
FALSE,FALSE,"INTUIT INC. (INTU)","Intuit Inc.","Intuit provides financial management products for small businesses, consumers, and accounting professionals. The flagship products for small businesses and consumers are QuickBooks and TurboTax. ProSeries and Lacerte are Intuit’s tax preparation offerings for professional accountants.","business services,consumer services,software","INTU"
FALSE,FALSE,"INTEL CORPORATION (INTC)","Intel Corporation","Intel designs and manufactures microprocessors and chipsets sold to original equipment manufacturers in the computing and communications industries. Company products are used in notebooks, desktops, servers, tablets, phones, wearables, and manufacturing devices.","hardware","INTC"
FALSE,FALSE,"IHS MARKIT LTD. (INFO)","Ihs Markit Ltd.","IHS Markit provides data and analytics for the major industries, financial markets and governments.","business services","INFO"
FALSE,FALSE,"INCYTE CORPORATION (INCY)","Incyte Corporation","Incyte is a biopharmaceutical company focused on the discovery, development and commercialization of proprietary therapeutics.","pharmaceuticals","INCY"
FALSE,FALSE,"ILLUMINA, INC. (ILMN)","Illumina, Inc.","Illumina makes sequencing- and array-based solutions for genetic analysis. Company customers include research institutions, government laboratories, and hospitals, as well as pharmaceutical, biotechnology, agrigenomics, molecular diagnostic laboratories, and consumer genomics companies.","equipment","ILMN"
TRUE,FALSE,"INTERNATIONAL GAME TECHNOLOGY (IGT)","International Game Technology","Acquired by GTECH in 2015, International Game Technology designed, manufactured, and marketed casino-style gaming equipment, systems, and game content for land-based, online real-money and online social gaming, primarily in North America.","equipment","IGT"
FALSE,FALSE,"INTERNATIONAL FLAVORS & FRAGRANCES INC. (IFF)","International Flavors & Fragrances Inc.","The company creates flavor and fragrance compounds that are used globally in food, beverage, personal care and household products.","materials","IFF"
FALSE,FALSE,"IDEXX LABORATORIES, INC. (IDXX)","Idexx Laboratories, Inc.","IDEXX provides veterinary products and services primarily for the companion animal veterinary, livestock and poultry, dairy and water testing markets.","pharmaceuticals","IDXX"
TRUE,FALSE,"NYSE EURONEXT (ICE)","Nyse Euronext","Acquired by the IntercontinentalExchange in 2013, NYSE Euronext was a global operator of financial markets and provider of trading solutions.","business services","ICE.ACQ"
FALSE,FALSE,"INTERCONTINENTAL EXCHANGE, INC. (ICE)","Intercontinental Exchange, Inc.","Intercontinental Exchange operates regulated exchanges, clearing houses and listings venues, and provides data services for commodity and financial markets.","business services","ICE"
FALSE,FALSE,"INTERNATIONAL BUSINESS MACHINES CORPORATION (IBM)","International Business Machines Corporation","IBM provides business IT services, such as infrastructure for cloud computing and analytics, application and process management services, as well as related software and server and storage system hardware.","hardware,IT services,software","IBM"
FALSE,FALSE,"IAC/INTERACTIVECORP. (IAC)","Iac/Interactivecorp.","IAC is a media and Internet company comprised of a number of products, such as HomeAdvisor, Vimeo, About.com, and the Match Group of online dating products.","internet","IAC"
FALSE,FALSE,"HUMANA INC. (HUM)","Humana Inc.","Humana provides medical and supplemental insurance plans sold to individuals and employers.","health care","HUM"
FALSE,FALSE,"THE HERSHEY COMPANY (HSY)","The Hershey Company","The Hershey Company is a successor to a business founded in 1894. The company is the largest producer of chocolate in North America, and provides chocolate and non-chocolate confectionery under a number of brand names worldwide.","consumer goods,materials","HSY"
FALSE,FALSE,"HOST HOTELS & RESORTS, INC. (HST)","Host Hotels & Resorts, Inc.","Host operates as a self-managed and self-administered REIT. The company operates a portfolio of luxury and upscale hotels, with the majority located in the U.S.","real estate,REIT","HST"
TRUE,FALSE,"HOSPIRA INC. (HSP)","Hospira Inc.","Acquired by Pfizer in 2015, Hospira was a provider of injectable drugs, such as generic acute-care and oncology injectables, and infusion technologies used by hospitals, clinics, home healthcare providers and long-term care facilities.","health care,pharmaceuticals","HSP"
FALSE,FALSE,"HENRY SCHEIN, INC. (HSIC)","Henry Schein, Inc.","The company distributes more than 100 thousand branded health care products and Henry Schein private brand products, primarily to office-based dental, animal health and medical practitioners.","business services,health care","HSIC"
TRUE,FALSE,"THE HILLSHIRE BRANDS COMPANY (HSH)","The Hillshire Brands Company","Acquired by Tyson Foods in 2014, Hillshire Brands was a manufacturer and marketer of foods under brands such as Jimmy Dean, Hillshire Farm, Van's, Sara Lee, and Aidells.","consumer goods","HSH"
FALSE,FALSE,"HARRIS CORPORATION (HRS)","Harris Corporation","Harris Corporation provides communications systems to the U.S. Department of Defense and other Defense agencies, National Intelligence, Public Safety, and Professional Communications markets.","equipment,hardware,telecommunications","HRS"
FALSE,FALSE,"HORMEL FOODS CORPORATION (HRL)","Hormel Foods Corporation","Hormel Foods Corporation was founded in 1891. The company is engaged in the production and marketing of food products, in particular pork and turkey, in the United States, Australia, Canada, China, Japan, and the Philippines.","consumer goods,materials","HRL"
FALSE,FALSE,"H&R BLOCK, INC. (HRB)","H&R Block, Inc.","H&R Block provides assisted income tax return preparation and digital do-it-yourself tax solutions primarily in the U.S., Canada, andAustralia.","business services,consumer services","HRB"
FALSE,FALSE,"HP INC. (HPQ)","Hp Inc.","HP provides a broad range of technology products and services, including personal computing devices, imaging and printing products, enterprise servers and storage solutions, networking products, technology consulting, outsourcing and support services, and IT operations management.","hardware,IT services","HPQ"
FALSE,FALSE,"HEWLETT PACKARD ENTERPRISE COMPANY (HPE)","Hewlett Packard Enterprise Company","Hewlett Packard Enterprise provides IT infrastructure hardware, software and consulting services.","hardware,IT services,software","HPE"
TRUE,FALSE,"HERCULES INCORPORATED (HPC)","Hercules Incorporated","Hercules makes chemicals used in the paper industry, paint and adhesives, construction materials, food, pharmaceutical, personal care, and other industrial applications.","materials","HPC"
FALSE,FALSE,"HELMERICH & PAYNE, INC. (HP)","Helmerich & Payne, Inc.","Helmerich & Payne is primarily engaged in contract drilling of oil and gas wells, principally in North and South America. The company draws customers primarily from the major oil companies, national oil companies, and larger independent producers.","engineering and construction,energy","HP"
TRUE,FALSE,"STARWOOD HOTEL & RESORTS WORLDWIDE, INC. (HOT)","Starwood Hotel & Resorts Worldwide, Inc.","Starwood operates hotels and resorts around the world. The company derives revenue primarily from hotel operation management fees, franchise fees, and the operation of company-owned hotels.","business services,consumer services","HOT"
FALSE,FALSE,"HONEYWELL INTERNATIONAL INC. (HON)","Honeywell International Inc.","Honeywell is a diversified technology and manufacturing company offering, among others, aerospace products and services, turbochargers, building control, sensing and security products, specialty chemicals, advanced materials, and process technology for refining and petrochemicals.","equipment,manufacturing","HON"
FALSE,FALSE,"HOLOGIC, INC. (HOLX)","Hologic, Inc.","Hologic makes diagnostics products, medical imaging systems and surgical products focusing on women's health.","health care,medical devices","HOLX"
FALSE,FALSE,"HARLEY-DAVIDSON, INC. (HOG)","Harley-Davidson, Inc.","Harley-Davidson was founded in 1903. The company operates in two reportable segments: the Motorcycles segment and the Financial Services segment. The Motorcycles segment designs, manufactures and sells at wholesale Harley-Davidson motorcycles as well as parts, accessories and related services. These products are sold to retail customers through a global network of independent dealers. The Financial Services segment provides wholesale and ","consumer goods","HOG"
TRUE,FALSE,"H. J. HEINZ COMPANY (HNZ)","H. J. Heinz Company","Acquired by Berkshire Hathaway and 3G Capital in June 2013, H. J. Heinz Company had been incorporated in 1900. The company manufactured and marketed an extensive line of food products throughout the world. Principal products included ketchup, condiments and sauces, frozen food, soups, beans and pasta meals, infant nutrition and other processed food products.","consumer goods","HNZ"
FALSE,FALSE,"HILTON WORLDWIDE HOLDINGS INC. (HLT)","Hilton Worldwide Holdings Inc.","Hilton operates hotels, resorts and timeshare properties around the world.","consumer services","HLT"
FALSE,FALSE,"THE HARTFORD FINANCIAL SERVICES GROUP, INC. (HIG)","The Hartford Financial Services Group, Inc.","The Hartford is a holding company for subsidiaries that provide property and casualty insurance, group benefits and mutual funds to individual and business customers in the U.S.","financial company,insurance","HIG"
FALSE,FALSE,"HIBBETT SPORTS, INC. (HIBB)","Hibbett Sports, Inc.","Hibbett Sports operates athletic specialty stores in small and mid-sized markets predominantly in the South, Southwest, Mid-Atlantic and the Midwest regions of the U.S. Company stores are located primarily in strip centers which are frequently influenced by a Wal-Mart store, and offer brand name footwear, apparel, accessories and athletic equipment in a full service environment.","retail","HIBB"
FALSE,FALSE,"HESS CORPORATION (HES)","Hess Corporation","Hess is engaged in exploration, production, transportation, purchase and sale of crude oil and natural gas with production operations located primarily in the U.S., Denmark, Equatorial Guinea, Thailand, Malaysia, and Norway.","energy","HES"
FALSE,FALSE,"THE HOME DEPOT, INC. (HD)","The Home Depot, Inc.","Home Depot is a North American home improvement retailer offering building materials, home improvement products and lawn and garden products, as well as a number of services.","retail","HD"
FALSE,FALSE,"HCP, INC. (HCP)","Hcp, Inc.","HCP is a real estate investment trust (REIT) that invests primarily in real estate serving the healthcare industry in the U.S., including senior housing, post-acute/skilled nursing facilities, life sciences facilities, medical offices and hospitals.","health care,real estate,REIT","HCP"
TRUE,FALSE,"HUDSON CITY BANCORP, INC. (HCBK)","Hudson City Bancorp, Inc.","Acquired by M&T Bank in November 2015, Hudson City Bancorp was a holding company of its only subsidiary, Hudson City Savings Bank. Hudson City Savings was a federally chartered stock savings bank conducting operations throughout the State of New Jersey.","banking,financial company","HCBK"
FALSE,FALSE,"HCA HOLDINGS, INC. (HCA)","Hca Holdings, Inc.","HCA operates general, acute care, and psychiatric hospitals and freestanding surgery centers in the U.S. and the U.K.","health care","HCA"
FALSE,FALSE,"HANESBRANDS INC. (HBI)","Hanesbrands Inc.","Hanesbrands manufactures and markets bras, panties, shapewear, hosiery, men’s underwear, children’s underwear, socks, T-shirts and other apparel under brands including Hanes, Champion, Maidenform, DIM, Playtex, Bali, JMS/Just My Size, L’eggs, Lovable, and Wonderbra.","consumer goods","HBI"
