index,acquired,bankruptcy,company,company_name,description,industry,ticker
0,FALSE,FALSE,"AGILENT TECHNOLOGIES, INC. (A)","Agilent Technologies, Inc.","Agilent Technologies provides bio-analytical and electronic measurement solutions to the communications, electronics, life sciences and chemical analysis industries.",hardware,A
1,FALSE,FALSE,AMERICAN SUPERCONDUCTOR CORPORATION (AMSC),American Superconductor Corporation,American Superconductor provides power electronics for wind turbines and power grids.,"equipment,hardware",AMSC
2,FALSE,FALSE,"AMERIPRISE FINANCIAL, INC. (AMP)","Ameriprise Financial, Inc.","Ameriprise provides financial planning, annuities, wealth, and asset management services.","asset management,financial company,financial services",AMP
3,FALSE,FALSE,AMGEN INC. (AMGN),Amgen Inc.,"Amgen develops, manufactures and markets medicines for serious illnesses.","health care,pharmaceuticals",AMGN
4,FALSE,FALSE,"AFFILIATED MANAGERS GROUP, INC. (AMG)","Affiliated Managers Group, Inc.","Affiliated Managers Group is a global asset management company with equity investments in boutique investment management firms, which maintain operational autonomy, and receive assistance from the company in marketing and distribution.","asset management,financial company",AMG
5,FALSE,FALSE,"AMETEK, INC. (AME)","Ametek, Inc.","AMETEK makes electronic instruments and electromechanical devices for the aerospace and defense, medical, mass transit, petrochemical, power and other industrial markets.","equipment,manufacturing",AME
6,FALSE,FALSE,"ADVANCED MICRO DEVICES, INC. (AMD)","Advanced Micro Devices, Inc.","AMD is a semiconductor company that primarily offers x86 microprocessors as standalone central processing units (CPU) or incorporated into accelerated processing units (APU), chipsets and discrete graphics processing units (GPUs) for the consumer, commercial and professional graphics markets.",hardware,AMD
7,FALSE,FALSE,AMC NETWORKS INC. (AMCX),Amc Networks Inc.,"AMC Networks owns and operates TV programming channels including AMC, WE tv, BBC AMERICA, IFC and Sundance, in the U.S. and internationally.",media,AMCX
8,FALSE,TRUE,"AMBAC FINANCIAL GROUP, INC. (AMBC)","Ambac Financial Group, Inc.","Ambac provides financial guarantees, such as credit derivative contracts, and other financial services to clients in the public and private sectors.","financial company,financial services,insurance",AMBC
9,FALSE,FALSE,"APPLIED MATERIALS, INC. (AMAT)","Applied Materials, Inc.","Applied provides manufacturing equipment, services and software to the semiconductor, display, and solar photovoltaic industries.","equipment,hardware",AMAT
10,FALSE,FALSE,"ALEXION PHARMACEUTICALS, INC. (ALXN)","Alexion Pharmaceuticals, Inc.","Alexion is a pharmaceutical company focused on ultra-rare life-threatening genetic disorders. Company products include Soliris, a therapeutic approved for paroxysmal nocturnal hemoglobinuria (PNH) and for atypical hemolytic uremic syndrome (aHUS); Strensiq for the treatment of Hypophosphatasia (HPP); and Kanuma for the treatment of Lysosomal Acid Lipase Deficiency (LAL-D).",pharmaceuticals,ALXN
11,TRUE,FALSE,ALTERA CORPORATION (ALTR),Altera Corporation,"Acquired by Intel in 2015, Altera was a global semiconductor company providing field-programmable gate array (FPGA) products to the telecom, wireless, industrial automation, military, auto, and other markets.",hardware,ALTR
12,FALSE,FALSE,ALLEGION PLC (ALLE),Allegion Plc,"Allegion offers mechanical and electronic security products, such as steel doors and door frames, electronic and biometric access control systems, locks and key systems. Company brands include Falcon, LCN, Kryptonite, and Schlage.","consumer goods,equipment",ALLE
13,FALSE,FALSE,THE ALLSTATE CORPORATION (ALL),The Allstate Corporation,Allstate provides property-liability and life insurance in the U.S. and Canada.,"financial company,insurance",ALL
14,FALSE,FALSE,"ALASKA AIR GROUP, INC. (ALK)","Alaska Air Group, Inc.","The company operates Alaska Airlines and Horizon Air, serving a route network spanning North America.",transportation,ALK
15,FALSE,FALSE,"ALIGN TECHNOLOGY, INC (ALGN)","Align Technology, Inc","Align designs, manufactures and markets the Invisalign System for tooth alignment therapy. The company also makes iTero oral scanners, and provides computer-aided design and manufacturing digital services used in dentistry, orthodontics, and dental records storage.",medical devices,ALGN
16,FALSE,FALSE,ZOETIS INC. (ZTS),Zoetis Inc.,"Zoetis developes, manufactures and commercializes animal medicines and vaccines. The company had been a business unit of Pfizer for more than 60 years, prior to becoming an independent public company in 2013.",pharmaceuticals,ZTS
17,FALSE,FALSE,ZIONS BANCORPORATION (ZION),Zions Bancorporation,"Zions provides community banking services, including business banking, commercial and residential development, construction and term lending, retail banking, residential mortgage servicing and lending, and trust and wealth management. The company operates primarily in the West and Southwest of the U.S.","banking,financial company",ZION
18,FALSE,FALSE,"ZIMMER BIOMET HOLDINGS, INC. (ZBH)","Zimmer Biomet Holdings, Inc.","Zimmer Biomet designs, manufactures and markets orthopaedic reconstructive products; sports medicine, biologics, extremities and trauma products; spine, bone healing, craniomaxillofacial and thoracic products; dental implants; and related surgical products.","health care,medical devices",ZBH
19,FALSE,FALSE,"YUM! BRANDS, INC. (YUM)","Yum! Brands, Inc.","YUM develops, operates, franchises and licenses KFC, Pizza Hut and Taco Bell restaurants worldwide.",consumer services,YUM
20,TRUE,FALSE,YAHOO! INC. (YHOO),Yahoo! Inc.,"Acquired by Verizon, Yahoo! generates revenue from display and search advertising on Yahoo! online properties and third-party websites.","internet,media",YHOO
21,FALSE,FALSE,XYLEM INC. (XYL),Xylem Inc.,"Xylem designs and manufactures equipment, and provides services, for water and wastewater applications, such as filtration and treatment.","engineering and construction,equipment",XYL
22,TRUE,FALSE,XTO ENERGY INC (XTO),Xto Energy Inc,"Acquired by Exxon Mobil in 2009, XTO Energy was engaged in exploration, development, and exploitation of oil and gas properties, and in the production, processing, marketing and transportation of oil and gas.",energy,XTO
23,FALSE,FALSE,XEROX CORPORATION (XRX),Xerox Corporation,"Xerox primarily provides business process outsourcing services, including customer care, transaction processing, finance and accounting, and human resources, and document outsourcing services, such as workflow automation and centralized print services.","business services,hardware",XRX
24,FALSE,FALSE,DENTSPLY SIRONA INC. (XRAY),Dentsply Sirona Inc.,"DENTSPLY designs, manufactures and markets consumable dental products for the professional dental market around the world.",health care,XRAY
25,FALSE,FALSE,EXXON MOBIL CORPORATION (XOM),Exxon Mobil Corporation,"Exxon Mobil explores for and produces crude oil and natural gas,  and manufactures and markets petroleum products and commodity petrochemicals.",energy,XOM
26,FALSE,FALSE,"XILINX, INC. (XLNX)","Xilinx, Inc.",Xilinx designs and develops programmable integrated circuits.,hardware,XLNX
27,TRUE,FALSE,XL GROUP PLC (XL),Xl Group Plc,"XL Group provides property and casualty insurance and reinsurance to industrial, commercial and professional firms, insurance companies and other enterprises.","financial company,insurance",XL
28,FALSE,FALSE,XCEL ENERGY INC. (XEL),Xcel Energy Inc.,"Xcel Energy is a holding company whose utility subsidiaries provide electricity and natural gas in Minnesota, Wisconsin, Colorado, Michigan, New Mexico, North and South Dakota, and Texas.",utility,XEL
29,FALSE,FALSE,CIMAREX ENERGY CO. (XEC),Cimarex Energy Co.,"Cimarex Energy is an oil and gas exploration and production company, operating mainly in Oklahoma, Texas and New Mexico.",energy,XEC
30,FALSE,FALSE,UNITED STATES STEEL CORPORATION (X),United States Steel Corporation,"U. S. Steel produces flat-rolled and tubular steel products from iron ore and coke, in North America and Europe.",materials,X
31,FALSE,FALSE,"WYNN RESORTS, LIMITED (WYNN)","Wynn Resorts, Limited","Wynn Resorts develops, owns and operates destination casino resorts that integrate hotel accommodations with dining outlets, premium retail, entertainment theaters and meeting complexes.",consumer services,WYNN
32,FALSE,FALSE,"WYNDHAM DESTINATIONS, INC. (WYND)","Wyndham Destinations, Inc.",Wyndham Destinations is a vacation ownership and exchange company with presence in over 100 countries.,consumer services,WYND
33,TRUE,FALSE,WYETH (WYE),Wyeth,"Acquired by Pfizer in 2009, Wyeth engaged in the discovery, development, manufacture, distribution and sale of pharmaceutical, consumer healthcare, and animal health products.","health care,pharmaceuticals",WYE
34,FALSE,FALSE,WEYERHAEUSER COMPANY (WY),Weyerhaeuser Company,"Weyerhaeuser grows and harvests trees, and manufactures and sells building products, pulp and paper.",materials,WY
35,TRUE,FALSE,WM. WRIGLEY JR. COMPANY (WWY),Wm. Wrigley Jr. Company,"Acquired by Mars, Incorporated in 2008, The Wm. Wrigley Jr. Company manufactured and marketed chewing gum and other confectionery products worldwide.",consumer goods,WWY
36,FALSE,FALSE,THE WESTERN UNION COMPANY (WU),The Western Union Company,"Western Union provides global money movement and payment services, primarily consumer-to-consumer money transfers, as well as consumer-to-business bill payments. The company also provides foreign exchange and cross-border, cross-currency transaction services for businesses and individuals.",consumer services,WU
37,FALSE,FALSE,WESTROCK COMPANY (WRK),Westrock Company,"WestRock manufactures containerboard and paperboard, and makes packaging solutions.",manufacturing,WRK
38,FALSE,FALSE,"WPX ENERGY, INC. (WPX)","Wpx Energy, Inc.",WPX is an oil and gas exploration and production company engaged in the exploitation of long-life unconventional properties in North Dakota and in the southwestern U.S..,energy,WPX
39,FALSE,FALSE,"WAL-MART STORES, INC. (WMT)","Wal-Mart Stores, Inc.","Wal-Mart operates retail stores, warehouse clubs and e-commerce websites around the world. The company strategy is to lead on price.",retail,WMT
40,FALSE,FALSE,"THE WILLIAMS COMPANIES, INC. (WMB)","The Williams Companies, Inc.","Williams is primarily a U.S. based operator of interstate gas pipelines, and provider of natural gas and natural gas liquids gathering, treatment, processing and compression services.",energy,WMB
41,FALSE,TRUE,"WASHINGTON MUTUAL, INC. (WM)","Washington Mutual, Inc.","Washington Mutual filed for bankruptcy in 2008. Prior to the bankruptcy, the company had been a consumer and small business banking company in the U.S.","banking,financial company",WAMU
42,FALSE,FALSE,"WASTE MANAGEMENT, INC. (WM)","Waste Management, Inc.","Waste Management provides waste collection, transfer, recycling and disposal services in North America. The company owns a number of landfill sites and landfill gas-to-energy facilities.","business services,consumer services",WM
43,FALSE,FALSE,WILLIS TOWERS WATSON PLC (WLTW),Willis Towers Watson Plc,"Willis Towers Watson provides property and liability insurance brokerage services, reinsurance, and employee benefits brokerage and consulting services.","business services,financial company,insurance",WLTW
44,FALSE,TRUE,"WINDSTREAM HOLDINGS, INC. (WINMQ)","Windstream Holdings, Inc.","Windstream provides broadband communications, voice and digital television to consumers in the U.S., as well as data, cloud solutions, unified communications and managed services to small business and enterprise clients.",telecommunications,WINMQ
45,FALSE,FALSE,WINMARK CORPORATION (WINA),Winmark Corporation,"Winmark franchises value-oriented retail store concepts that buy, sell and trade used merchandise, such as used clothing and accessories, toys, sporting goods, or musical instruments, in the U.S. and Canada.",retail,WINA
46,FALSE,FALSE,WHIRLPOOL CORPORATION (WHR),Whirlpool Corporation,"Whirlpool manufactures and markets major home appliances, such as refrigerators, cooking stoves, dishwashers, and 
laundry machines under brand names such as Whirlpool, KitchenAid, and Maytag.",consumer goods,WHR
47,FALSE,FALSE,WEATHERFORD INTERNATIONAL PUBLIC LIMITED COMPANY (WFT),Weatherford International Public Limited Company,"Weatherford provides equipment and services used in the drilling, evaluation, completion, production and intervention of oil and gas wells.","engineering and construction,energy,equipment",WFT
48,TRUE,FALSE,"WHOLE FOODS MARKET, INC. (WFM)","Whole Foods Market, Inc.","Acquired by Amazon in 2017, Whole Foods operated natural and organic foods supermarkets in the U.S., Canada, and the U.K.",retail,WFM
49,FALSE,FALSE,WELLS FARGO & COMPANY (WFC),Wells Fargo & Company,"Wells Fargo provides retail, commercial and corporate banking across the U.S., as well as wholesale banking, mortgage banking, equipment leasing, securities brokerage, investment banking, and other financial services.","banking,financial company",WFC
50,FALSE,FALSE,THE WENDY'S COMPANY (WEN),The Wendy'S Company,Wendy’s owns and franchises Wendy’s restaurants in the U.S..,consumer services,WEN
51,FALSE,FALSE,WELLTOWER INC. (WELL),Welltower Inc.,"Welltower is a real estate investment trust (REIT) that owns properties in the U.S., Canada and the U.K., consisting of seniors housing and post-acute communities and outpatient medical facilities.","health care,real estate,REIT",WELL
52,FALSE,FALSE,"WEC ENERGY GROUP, INC. (WEC)","Wec Energy Group, Inc.","WEC Energy Group is a holding company, whose subsidiaries provide regulated natural gas and electricity, as well as nonregulated renewable energy primarily in Wisconsin, Illinois, and other Midwestern states of the U.S.",utility,WEC
53,FALSE,FALSE,"WADDELL & REED FINANCIAL, INC. (WDR)","Waddell & Reed Financial, Inc.","Waddell & Reed provides investment management, advisory, underwriting and distribution for mutual funds and institutional and separately managed accounts.","asset management,financial company",WDR
54,FALSE,FALSE,WESTERN DIGITAL CORPORATION (WDC),Western Digital Corporation,Western Digital makes data storage solutions such as hard disk drives and solid-state drives,hardware,WDC
55,FALSE,FALSE,"WALGREENS BOOTS ALLIANCE, INC. (WBA)","Walgreens Boots Alliance, Inc.","Walgreens Boots Alliance operates retail pharmacies across the U.S. and Europe under brands including Walgreens, Duane Reade, Boots and Alliance Healthcare. The company also operates a global pharmaceutical wholesale and distribution network, and a portfolio of","health care,retail",WBA
56,TRUE,FALSE,WACHOVIA CORPORATION (WB),Wachovia Corporation,"Acquired by Wells Fargo in 2008, Wachovia provided commercial and retail banking and trust services.","banking,financial company",WB
57,FALSE,FALSE,WATERS CORPORATION (WAT),Waters Corporation,"Waters designs, manufactures, sells and services liquid chromatography, mass spectrometry, thermal analysis, rheometry and calorimetry analytical instruments, related software, and consumables. These products are used by life sciences, biochemical, industrial, nutritional safety, environmental, academic and governmental customers.",equipment,WAT
58,TRUE,FALSE,WALGREEN CO (WAG),Walgreen Co,"Prior to its merger with Alliance Boots in 2014, Walgreen primarily operated drugstores and specialty pharmacies in the U.S.",retail,WAG
59,FALSE,FALSE,VERIZON COMMUNICATIONS INC. (VZ),Verizon Communications Inc.,"Verizon provides wireless voice and data communications, wireline broadband video and data for consumers in the U.S. The company offers corporate networking solutions, data center and cloud services to business and government customers in the U.S. and abroad.",telecommunications,VZ
60,FALSE,FALSE,VENTAS INC (VTR),Ventas Inc,"Ventas is a real estate investment trust (REIT) that owns a portfolio of seniors housing and healthcare properties located in the U.S., Canada and the U.K.","health care,real estate,REIT",VTR
61,FALSE,FALSE,VERTEX PHARMACEUTICALS INCORPORATED (VRTX),Vertex Pharmaceuticals Incorporated,"Vertex Pharmaceuticals discovers, develops, manufactures and commercializes therapies for the treatment of cystic fibrosis, including ORKAMBI and KALYDECO.",pharmaceuticals,VRTX
62,FALSE,FALSE,"VERISIGN, INC. (VRSN)","Verisign, Inc.",VeriSign provides Internet domain name registry and Internet security services.,IT services,VRSN
63,FALSE,FALSE,"VERISK ANALYTICS, INC. (VRSK)","Verisk Analytics, Inc.","Verisk Analytics provides data analytics services to insurance, natural resources, healthcare, financial services, government, and risk management customers. The company collects and analyzes billions of data records to provide decision making information integrated into customer workflows.",IT services,VRSK
64,FALSE,FALSE,VORNADO REALTY TRUST (VNO),Vornado Realty Trust,"Vornado is a real estate investment trust (REIT) that owns office space and residential properties, primarily in New York City and Washington D.C.","real estate,REIT",VNO
65,FALSE,FALSE,VULCAN MATERIALS COMPANY (VMC),Vulcan Materials Company,"Vulcan is a U.S. based producer of crushed stone, sand and gravel used in construction, and of asphalt mix and ready-mixed concrete.",materials,VMC
66,FALSE,FALSE,VALERO ENERGY CORPORATION (VLO),Valero Energy Corporation,"Valero operates petroleum refineries in the U.S., Canada, and the U.K., and markets refined products through Valero-branded gas stations and on a wholesale basis. The company also operates ethanol plants in the central plains region of the U.S.","energy,materials",VLO
67,FALSE,FALSE,"MERIDIAN BIOSCIENCE, INC. (VIVO)","Meridian Bioscience, Inc.","Meridian develops, manufactures, sells and distributes disease diagnostic test kits, bulk antigens, antibodies, and bioresearch reagents, and performs contract development and manufacture of proteins and other biologicals for use by biopharmaceutical and biotechnology companies engaged in research for new drugs and vaccines.","health care,medical devices,pharmaceuticals",VIVO
68,FALSE,FALSE,VIAVI SOLUTIONS INC. (VIAV),Viavi Solutions Inc.,"Viavi, formerly JDS Uniphase Corporation, is a provider of network equipment and optical products for telecommunications service providers, equipment manufacturers and enterprises. The company also provides anti-counterfeiting solutions for currency authentication, and optical instruments for security, safety, and other applications.",hardware,VIAV
69,FALSE,FALSE,"VIACOM, INC. (VIA)","Viacom, Inc.","Viacom creates TV programs, films, entertainment applications, games, and consumer products. Company media brands include Nickelodeon, Comedy Central, BET, and Paramount Pictures.",media,VIA
70,FALSE,FALSE,VARIAN MEDICAL SYSTEMS INC (VAR),Varian Medical Systems Inc,"Varian Medical Systems makes medical devices and software for treating cancer and other conditions with radiotherapy, radiosurgery, proton therapy and brachytherapy. The company also makes X-ray imaging components for medical, scientific, cargo screening, and industrial applications.","equipment,health care,medical devices",VAR
71,FALSE,FALSE,U.S. BANCORP (USB),U.S. Bancorp,"U.S. Bancorp is a bank holding company that provides lending and depository services, cash management, capital markets, trust and investment management, as well as credit card services, merchant and ATM processing, mortgage banking, insurance, brokerage and leasing.","banking,financial company",USB
72,FALSE,FALSE,"UNITED RENTALS, INC. (URI)","United Rentals, Inc.","The company rents construction and industrial equipment, aerial work platforms, trench safety equipment, power and HVAC equipment, pumps, and general tools and light equipment in the U.S. and Canada.","engineering and construction,equipment",URI
73,FALSE,FALSE,VISA INC. (V),Visa Inc.,"Visa is a global payments technology company that operates a payment processing network, which facilitates authorization, clearing and settlement of payment transactions, and provides fraud protection for account holders. Visa does not issue cards, extend credit or set rates for account holders. In most cases, account holder and merchant relationships are managed by Visa's financial institution clients.","business services,financial company,financial services",V
74,TRUE,FALSE,UST INC. (UST),Ust Inc.,"Acquired by Altria Group in 2008, UST was engaged in manufacturing and marketing of smokeless tobacco products and wine.",consumer goods,UST
75,FALSE,FALSE,"URBAN OUTFITTERS, INC. (URBN)","Urban Outfitters, Inc.","Urban Outfitters is a retail and wholesale apparel, accessories, and home goods company, operating under the Urban Outfitters, Anthropologie, Free People, Terrain and Bhldn brands. Company retails stores are primarily located in the U.S., Canada, and Western Europe.",retail,URBN
76,FALSE,FALSE,UNITED TECHNOLOGIES CORPORATION (UTX),United Technologies Corporation,"United Technologies is a diversified technology company. Its products include Otis elevators and escalators; building heating, ventilating, air conditioning and refrigeration systems; Pratt & Whitney aircraft engines and other aerospace products and services sold to aircraft manufacturers, airlines and governments.","conglomerate,equipment",UTX
77,FALSE,FALSE,"UNITED PARCEL SERVICE, INC. (UPS)","United Parcel Service, Inc.","United Parcel Service is a package delivery company that was founded in 1907. The company delivers packages in over 200 countries and provides logistics services, such as distribution, customs brokerage and insurance.",transportation,UPS
78,FALSE,FALSE,V.F. CORPORATION (VFC),V.F. Corporation,"VF designs, produces, markets and distributes branded apparel and footwear. Company brands include The North Face, Vans, Timberland, Wrangler, Lee, Nautica, Majestic and Kipling.","consumer goods,retail",VFC
79,FALSE,FALSE,UNION PACIFIC CORPORATION (UNP),Union Pacific Corporation,"Union Pacific provides railroad transportation in the western two-thirds of the U.S., primarily transporting agricultural, automotive, chemical, and industrial products and coal.",transportation,UNP
80,FALSE,FALSE,UNUM GROUP (UNM),Unum Group,Unum provides life and disability insurance in the U.S. and the U.K.,"financial company,insurance",UNM
81,FALSE,FALSE,UNITEDHEALTH GROUP INCORPORATED (UNH),Unitedhealth Group Incorporated,"UnitedHealth provides employer, individual, Medicare, and other health insurance plans.",health care,UNH
82,FALSE,FALSE,"ULTA SALON, COSMETICS & FRAGRANCE, INC. (ULTA)","Ulta Salon, Cosmetics & Fragrance, Inc.","Ulta Beauty is a beauty retailer in the U.S. that offers cosmetics, fragrances, skin and hair care products, and salon services.",retail,ULTA
83,FALSE,FALSE,UNISYS CORPORATION (UIS),Unisys Corporation,"Unisys provides information technology services to enterprises and governments. Offerngs include cloud and IT infrastructure, application services, security solutions and server technology.",IT services,UIS
84,FALSE,FALSE,"UNIVERSAL HEALTH SERVICES, INC. (UHS)","Universal Health Services, Inc.","The company owns and operates acute care hospitals, behavioral health centers, surgical hospitals, ambulatory surgery centers and radiation oncology centers, primarily in the U.S. and the U.K.",health care,UHS
85,FALSE,FALSE,"UNITED-GUARDIAN, INC. (UG)","United-Guardian, Inc.","United-Guardian manufactures and markets cosmetic ingredients, personal care and health care products, pharmaceuticals, medical lubricants, and specialty industrial products.","health care,materials",UG
86,FALSE,FALSE,"UDR, INC. (UDR)","Udr, Inc.","UDR is a real estate investment trust (REIT) that develops, owns, and operates multifamily apartment communities throughout the U.S.","real estate,REIT",UDR
87,FALSE,TRUE,"UNITED CONTINENTAL HOLDINGS, INC. (UAL)","United Continental Holdings, Inc.","The company is a holding company parent of United Airlines, transporting people and cargo through a global route network with hubs at Newark Liberty, Chicago O’Hare, Denver, George Bush Houston, Los Angeles, A.B. Won Pat Guam, San Francisco and Washington Dulles International airports.",transportation,UAL
88,FALSE,FALSE,"UNDER ARMOUR, INC. (UA)","Under Armour, Inc.","Under Armour developes, markets and distributes branded athletic apparel, footwear and accessories. The company primarily sells its products on a wholesale basis to retailers.",consumer goods,UA
89,TRUE,FALSE,TYCO INTERNATIONAL PLC (TYC),Tyco International Plc,"Acquired by Johnson Controls in 2016, Tyco provided security products and services, fire detection and suppression products, and life safety products.",manufacturing,TYC
90,FALSE,FALSE,TEXTRON INC. (TXT),Textron Inc.,"Textron is a diversified company that manufactures, sells, and services Beechcraft, Cessna, and Hawker aircraft, Bell helicopters, unmanned aircraft systems and weapons, and fuel systems and automotive components. The company also provides financing to purchasers of its aircraft and helicopters",equipment,TXT
91,FALSE,FALSE,TEXAS INSTRUMENTS INCORPORATED (TXN),Texas Instruments Incorporated,"TI designs and makes semiconductors that it sells to electronics manufacturers around the world. Products include analog semiconductors, digital signal processors, microcontrollers.",hardware,TXN
92,FALSE,FALSE,TIME WARNER INC. (TWX),Time Warner Inc.,"Time Warner is a media and entertainment company that operates a cable TV network and digital media properties, provides Home Box Office (HBO) premium pay television and streaming services, and owns Warner Bros. film, home video and videogame production and distribution.",media,TWX
