"acquired","bankruptcy","company","company_name","description","ticker","industry_n","industry"
FALSE,FALSE,"CITRIX SYSTEMS, INC. (CTXS)","Citrix Systems, Inc.","Citrix develops and sells products and services that enable network delivery of software applications. The company offers 
products that virtualize Windows applications and desktops in the datacenter and deliver a cloud-like service to users anywhere on any device. The company also provides products for IT organizations to secure and manage mobile devices, apps and data.","CTXS","industry_1","software"
TRUE,FALSE,"CENTEX CORPORATION (CTX)","Centex Corporation","Acquired by Pulte Homes in 2009, Centex was a residential construction and mortgage lending and services company, engaged in construction and sale of detached and attached single-family homes.","CTX","industry_1","engineering and construction"
FALSE,FALSE,"COGNIZANT TECHNOLOGY SOLUTIONS CORPORATION (CTSH)","Cognizant Technology Solutions Corporation","Cognizant provides business, process, operations and IT consulting and outsourcing, application development, systems integration, and enterprise information management services, focusing on the financial services, healthcare, manufacturing, retail, and logistics industries.","CTSH","industry_1","IT services"
FALSE,FALSE,"CENTURYLINK, INC. (CTL)","Centurylink, Inc.","CenturyLink provides communications services including local and long-distance voice, high-speed Internet, colocation, managed and cloud hosting, to residential and business customers.","CTL","industry_1","telecommunications"
FALSE,FALSE,"CINTAS CORPORATION (CTAS)","Cintas Corporation","Cintas provides uniforms, floor care, restroom supplies, and first aid and safety products and services to businesses ranging from small service and manufacturing companies to major corporations that employ thousands of people.","CTAS","industry_1","business services"
FALSE,FALSE,"CSX CORPORATION (CSX)","Csx Corporation","CSX provides railroad transportation services and transport of intermodal containers and trailers, primarily in the Eastern U.S. and Canadian provinces of Ontario and Quebec.","CSX","industry_1","transportation"
TRUE,FALSE,"CSRA INC. (CSRA)","Csra Inc.","CSRA provides information technology services to the U.S. federal government. The Department of Defense is the company's largest customer.","CSRA","industry_1","IT services"
FALSE,FALSE,"CISCO SYSTEMS, INC. (CSCO)","Cisco Systems, Inc.","Cisco designs and sells networking and communications products, including switches; routers; voice, video and data communication and collaboration applications; digital video and interactive set-top boxes, cable modems and service provider solutions; and data center software and hardware,","CSCO","industry_1","hardware"
FALSE,FALSE,"CORVEL CORPORATION (CRVL)","Corvel Corporation","CorVel provides workers’ compensation solutions for employers, third party administrators, insurance companies, and government agencies. Services include claims management, bill review, preferred provider networks, utilization management, case management, pharmacy services, directed care and Medicare services.","CRVL","industry_1","business services"
FALSE,FALSE,"SALESFORCE.COM, INC. (CRM)","Salesforce.Com, Inc.","Salesforce provides enterprise cloud computing solutions, with a focus on customer relationship management, or CRM.","CRM","industry_1","business services"
TRUE,FALSE,"CELERA CORPORATION (CRA)","Celera Corporation","Acquired by Quest Diagnostics in 2011, Celera provided cardiovascular disease clinical laboratory testing services, and developed, manufactured, and oversaw the commercialization of molecular diagnostic products.","CRA","industry_1","health care"
FALSE,FALSE,"CRANE CO. (CR)","Crane Co.","Crane is a diversified manufacturer of industrial products that include valves for the chemical, oil and gas, power, construction, and other industries; payment acceptance products for retail self-checkout, vending, casino gaming, government lotteries, parking and transit fare collection; custom products used in landing systems, sensing and utility systems, fluid management, seat actuation, power and microelectronic applications, and micr","CR","industry_1","equipment"
TRUE,FALSE,"COMPUWARE CORPORATION (CPWR)","Compuware Corporation","Compuware is an enterprise software vendor. Its application monitoring software provides IT teams with a view of application performance, availability, and service levels. Its Mainframe software products support development, maintenance, testing, and data compliance of mainframe applications in the IBM z/OS environment.","CPWR","industry_1","IT services"
FALSE,FALSE,"CAPRI HOLDINGS LIMITED (CPRI)","Capri Holdings Limited","Capri Holdings Limited is a fashion luxury group, consisting of Michael Kors, Versace, and Jimmy Choo brands. The company sells women’s and men’s accessories, footwear, watches, jewelry, eyewear and fragrances.","CPRI","industry_1","consumer goods"
TRUE,TRUE,"CALPINE CORPORATION (CPN)","Calpine Corporation","Acquired in 2018, Calpine sold power, steam, and other energy products and services to utilities, electric system operators, industrial and agricultural companies, municipalities, as well as retail commercial, industrial and residential customers. The company primarily operated natural gas-fired and geothermal power plants in North America, with presence in California, Texas, and the Northeast and Mid-Atlantic regions of the U.S.","CPN","industry_1","energy"
FALSE,FALSE,"CAMPBELL SOUP COMPANY (CPB)","Campbell Soup Company","Campbell Soup Company manufactures and markets branded convenience food products, including Campbell’s condensed and ready-to-serve soups; Swanson broth and stocks; Prego pasta sauces; Pace Mexican sauces; Campbell’s gravies, pasta, beans and dinner sauces; Swanson canned poultry; Plum food and snacks; Pepperidge Farm bakery and frozen products; V8 beverages, and Campbell’s tomato juice.","CPB","industry_1","consumer goods"
TRUE,FALSE,"COVIDIEN PLC (COV)","Covidien Plc","Acquired by Medtronic plc in 2015, Covidien developed, manufactured and sold medical devices, pharmaceuticals, and medical supplies for use in clinical and home settings.","COV","industry_1","health care"
FALSE,FALSE,"COTY INC. (COTY)","Coty Inc.","Coty provides color cosmetics, retail hair coloring and styling products, body care and fragrances.","COTY","industry_1","consumer goods"
FALSE,FALSE,"COSTCO WHOLESALE CORPORATION (COST)","Costco Wholesale Corporation","Costco operates membership warehouses based on the concept that offering low prices on a limited selection of branded and private-label products will produce high sales volumes and rapid inventory turnover. The company operates in the U.S., Canada, the U.K., Mexico, Japan, Australia, Spain, and through majority-owned subsidiaries in Taiwan and Korea.","COST","industry_1","retail"
FALSE,FALSE,"CONOCOPHILLIPS (COP)","Conocophillips","ConocoPhillips is an oil and gas exploration and production company with operations in over 20 countries.","COP","industry_1","energy"
FALSE,FALSE,"THE COOPER COMPANIES, INC. (COO)","The Cooper Companies, Inc.","Cooper makes contact lenses and provides products and services focusing on women's health and in-vitro fertilization.","COO","industry_1","medical devices"
TRUE,FALSE,"ROCKWELL COLLINS, INC. (COL)","Rockwell Collins, Inc.","Acquired by United Technologies in November 2018, Rockwell Collins designed, produced and supported communications and aviation systems for commercial and military customers. Company products included avionics, aircraft cabin electronics, communications and navigation systems, situational awareness and surveillance products, electro-mechanical pilot control solutions, precision targeting, electronic warfare and range and training systems,","COL","industry_1","equipment"
FALSE,FALSE,"CABOT OIL & GAS CORPORATION (COG)","Cabot Oil & Gas Corporation","Cabot is engaged in natural gas and oil development, exploitation, exploration and production in the continental U.S.","COG","industry_1","energy"
FALSE,FALSE,"CAPITAL ONE FINANCIAL CORPORATION (COF)","Capital One Financial Corporation","Capital One is a financial services holding company. Its principal subsidiaries are: Capital One Bank (USA), National Association, offering credit and debit card products, and Capital One, National Association, which offers banking products and financial services to consumers, small businesses and commercial clients.","COF","industry_1","banking"
FALSE,FALSE,"CONSOL ENERGY INC (CNX)","Consol Energy Inc","CONSOL Energy engages in oil and gas exploration and production and coal mining in the Appalachian Basin.","CNX","industry_1","energy"
FALSE,FALSE,"CENTERPOINT ENERGY, INC. (CNP)","Centerpoint Energy, Inc.","CenterPoint is a public utility holding company, whose subsidiaries provide electricity and gas in the Texas Gulf Coast area that includes the city of Houston. The company owns and operates natural gas distribution systems, offering natural gas supplies primarily to commercial and industrial customers and electric and gas utilities.","CNP","industry_1","utility"
FALSE,FALSE,"CNO FINANCIAL GROUP, INC. (CNO)","Cno Financial Group, Inc.","CNO provides health insurance, annuity, and individual life insurance products, focusing on middle-income pre-retiree and retired Americans. The company sells its products through career agents, independent producers, and direct marketing.","CNO","industry_1","financial company"
FALSE,FALSE,"CENTENE CORPORATION (CNC)","Centene Corporation","Centene provides health plan coverage to individuals through government subsidized programs, including Medicaid and the Supplemental Security Income Program, as well as healthcare services to state programs, correctional facilities, healthcare organizations, employer groups and other commercial organizations.","CNC","industry_1","health care"
TRUE,FALSE,"COMVERSE TECHNOLOGY, INC (CMVT)","Comverse Technology, Inc","Acquired by Verint Systems in 2013, Comverse provided prepaid and postpaid billing and customer management software products to wireless, wireline and cable network operators.","CMVT","industry_1","software"
FALSE,FALSE,"CMS ENERGY CORPORATION (CMS)","Cms Energy Corporation","CMS Energy is an energy company operating primarily in Michigan. It is the parent holding company of Consumers, an electric and gas utility, and CMS Enterprises, an independent power producer.","CMS","industry_1","utility"
FALSE,FALSE,"CUMMINS INC. (CMI)","Cummins Inc.","Cummins designs, manufactures, distributes and services diesel and natural gas engines and engine-related component products, including filtration, after-treatment, turbochargers, fuel systems, controls systems, air handling systems and electric power generation systems. The company sells to original equipment manufacturers, distributors and other customers, and has a worldwide network of company-owned and independent distributors and dealers.","CMI","industry_1","equipment"
FALSE,FALSE,"CHIPOTLE MEXICAN GRILL, INC. (CMG)","Chipotle Mexican Grill, Inc.","Chipotle operates Chipotle Mexican Grill restaurants, which serve burritos, tacos, burrito bowls and salads, primarily in the U.S.","CMG","industry_1","consumer services"
FALSE,FALSE,"CME GROUP INC. (CME)","Cme Group Inc.","CME Group traces it roots to the 1800's futures exchanges and the Chicago Mercantile Exchange. Company products include exchange-traded and privately negotiated futures and options contracts and swaps, traded through its electronic trading platform and its trading facilities in Chicago and New York City. The company also provides hosting, connectivity and customer support for electronic trading through its co-location services; clearing a","CME","industry_1","business services"
FALSE,FALSE,"COMCAST CORPORATION (CMCSA)","Comcast Corporation","Comcast has two primary businesses: Comcast Cable and NBCUniversal. Comcast Cable provides video, high-speed Internet and voice services to residential and business customers in the U.S. under the XFINITY brand. NBCUniversal operates national and regional sports and news networks, NBC and Telemundo broadcast television stations, Universal Pictures, and Universal theme parks.","CMCSA","industry_1","telecommunications"
FALSE,FALSE,"COMERICA INCORPORATED (CMA)","Comerica Incorporated","Comerica provides banking services primarily in Texas, California and Michigan.","CMA","industry_1","banking"
FALSE,FALSE,"THE CLOROX COMPANY (CLX)","The Clorox Company","Clorox manufactures and markets consumer and professional products, including bleach and cleaning brands, clog removers, home and personal care products, cat litter, bags, wraps and containers, charcoal, dressings and sauces, and water-filtration brands. The company was founded in 1913.","CLX","industry_1","consumer goods"
FALSE,FALSE,"CLIFFS NATURAL RESOURCES INC. (CLF)","Cliffs Natural Resources Inc.","Cliffs is a mining and natural resources company in the U.S., tracing its history to 1847. It supplies iron ore pellets to the North American steel industry from mines and pellet plants located in Michigan and Minnesota. Additionally, Cliffs operates an iron ore mining complex in Western Australia.","CLF","industry_1","materials"
FALSE,FALSE,"COLGATE-PALMOLIVE COMPANY (CL)","Colgate-Palmolive Company","Colgate is a consumer products company founded in 1806. Its products include toothpaste, manual toothbrush, and mouthwash brands, as well as pharmaceutical products for dentists; liquid hand soap, shower gel, bar soap, deodorant and antiperspirant, shampoo and conditioner brands; dishwashing liquids, household cleaners and fabric softeners.","CL","industry_1","consumer goods"
FALSE,TRUE,"CIT GROUP INC. (CIT)","Cit Group Inc.","CIT was formed in 1908. The company offers financing, leasing and advisory services, principally to middle market companies in a variety of industries in North America, and equipment financing and leasing solutions to the transportation industry worldwide. CIT provides banking and related services to commercial and individual customers through its CIT Bank, N.A. subsidiary, which has branches in southern California.","CIT","industry_1","banking"
FALSE,FALSE,"CINCINNATI FINANCIAL CORPORATION (CINF)","Cincinnati Financial Corporation","Cincinnati Financial provides business, homeowner and auto insurance, life insurance, disability income policies and fixed annuities, marketed through independent insurance agencies in the U.S.","CINF","industry_1","financial company"
FALSE,FALSE,"CIENA CORPORATION (CIEN)","Ciena Corporation","Ciena provides network operators with equipment, software and services for the transport, switching, aggregation and management of voice, video and data traffic on communications networks.","CIEN","industry_1","hardware"
FALSE,FALSE,"CIGNA CORPORATION (CI)","Cigna Corporation","Cigna provides medical, dental, disability, life and accident insurance, primarily to employers and their employees, and seniors with Medicare and Medicaid plans.","CI","industry_1","financial company"
FALSE,FALSE,"C.H. ROBINSON WORLDWIDE, INC. (CHRW)","C.H. Robinson Worldwide, Inc.","C.H. Robinson  is a third party logistics company, providing freight transportation services and logistics solutions to companies in a variety of industries. In addition to transportation, the company provides services for the buying, selling, and marketing of fresh fruits, vegetables, and other perishable items, which was its original business dating back to 1905.","CHRW","industry_1","business services"
FALSE,FALSE,"CHESAPEAKE ENERGY CORPORATION (CHK)","Chesapeake Energy Corporation","Chesapeake is a U.S. oil and gas producer. The company has assets in the Eagle Ford Shale in Texas, the Utica Shale in Ohio and Pennsylvania, the Anadarko Basin in Oklahoma and Texas, the Niobrara Shale in the Powder River Basin in Wyoming, the Haynesville/Bossier Shales in Louisiana and Texas, the Marcellus Shale in the Appalachian Basin in Pennsylvania, and the Barnett Shale in the Fort Worth Basin in Texas.","CHK","industry_1","energy"
FALSE,FALSE,"CHURCH & DWIGHT CO., INC. (CHD)","Church & Dwight Co., Inc.","The company, founded in 1846, makes branded household, personal care and specialty consumer products, such as Arm & Hammer baking soda, cat litter, and laundry detergents, Trojan condoms, lubricants and vibrators, Oxiclean and Xtra cleaning solutions and detergents, Spinbrush toothbrushes, and First Response home pregnancy and ovulation test kits. The company sells its products through supermarkets, drugstores, convenience stores, and onl","CHD","industry_1","consumer goods"
TRUE,FALSE,"CAREFUSION CORPORATION (CFN)","Carefusion Corporation","Acquired by Becton, Dickinson in 2015, CareFusion was a global medical technology company with products including IV infusion systems, valves, administration sets and accessories, automated medication dispensing and supply management systems, and respiratory ventilators.","CFN","industry_1","health care"
FALSE,FALSE,"CITIZENS FINANCIAL GROUP, INC. (CFG)","Citizens Financial Group, Inc.","The company is a bank holding company, with retail bank operations in the New England, Mid-Atlantic and Midwest regions of the U.S.","CFG","industry_1","banking"
TRUE,FALSE,"COUNTRYWIDE FINANCIAL CORPORATION (CFC)","Countrywide Financial Corporation","Countrywide Financial engaged in mortgage banking, banking and mortgage warehouse lending, dealing in securities and insurance underwriting. After suffering credit losses in 2007, the Company was acquired by Bank of America in 2008.","CFC","industry_1","banking"
FALSE,FALSE,"CF INDUSTRIES HOLDINGS, INC. (CF)","Cf Industries Holdings, Inc.","CF Holdings manufactures and distributes nitrogen fertilizer and other nitrogen products, serving farmers, distributors, and industrial users.","CF","industry_1","materials"
FALSE,FALSE,"CERNER CORPORATION (CERN)","Cerner Corporation","Cerner supplies health care information technology. The company offers integrated clinical, financial and management information systems and services to hospitals, physician practices, laboratories, clinics, retail pharmacies, and employer sites.","CERN","industry_1","health care"
FALSE,FALSE,"CELGENE CORPORATION (CELG)","Celgene Corporation","Celgene is a biopharmaceutical company that develops and commercializes therapies for the treatment of cancer and inflammatory diseases. Company products include Revlimid, Pomalyst/Imnovid, Abraxane, Otezla, Vidaza, Thalomid, and Istodax.","CELG","industry_1","health care"
TRUE,FALSE,"CONSTELLATION ENERGY GROUP, INC (CEG)","Constellation Energy Group, Inc","Acquired by Excelon Corporation in 2012, Constellation Energy was an energy company that included a merchant energy business and a regulated electric and gas public utility in the City of Baltimore and 10 counties in Maryland.","CEG","industry_1","utility"
FALSE,FALSE,"CADENCE DESIGN SYSTEMS, INC. (CDNS)","Cadence Design Systems, Inc.","Cadence Design Systems offers software, services, and reusable integrated circuit designs to customers who design electronic products.","CDNS","industry_1","software"
TRUE,FALSE,"CLEAR CHANNEL COMMUNICATIONS, INC. (CCU)","Clear Channel Communications, Inc.","Prior to its 2006 acquisition, Clear Channel was a diversified media company engaged in radio broadcasting and outdoor advertising.","CCU","industry_1","media"
FALSE,FALSE,"CARNIVAL CORPORATION (CCL)","Carnival Corporation","Carnival operates vacation cruise ships. Carnival Corporation and Carnival plc operate a dual listed company, with the businesses of both companies combined through a number of contracts, as if they were a single economic enterprise with a single senior executive management team and identical Boards of Directors, but each has retained its separate legal identity, stock exchange listing and its own shareholders.","CCL","industry_1","consumer services"
FALSE,FALSE,"CROWN CASTLE INTERNATIONAL CORP. (CCI)","Crown Castle International Corp.","The company is a REIT that owns, operates and leases shared wireless infrastructure, such as towers and small cell networks supported by fiber.","CCI","industry_1","real estate"
FALSE,FALSE,"COCA-COLA ENTERPRISES, INC. (CCE)","Coca-Cola Enterprises, Inc.","Coca-Cola Enterprises, Inc. markets, produces, and distributes nonalcoholic beverages. The Company is the strategic bottling partner of The Coca-Cola Company (TCCC) in Western Europe, with 10-year bottling agreements with TCCC for each territory it serves.","CCE","industry_1","manufacturing"
TRUE,FALSE,"[FORMER] COCA-COLA ENTERPRISES, INC (CCE)","[Former] Coca-Cola Enterprises, Inc","Acquired by The Coca-Cola Company in 2010, Coca-Cola Enterprises had perpetual bottling rights within its U.S. territories for products with the name ""Coca-Cola."" The company marketed, produced, and distributed nonalcoholic beverages, principally made from syrups and concentrates purchased from The Coca-Cola Company","CCE.ACQ","industry_1","manufacturing"
FALSE,FALSE,"CBS CORPORATION (CBS)","Cbs Corporation","CBS Corporation is a mass media company that operates the CBS Television Network, TV studios, Showtime Cable Network, the Movie Channel, CBS Sports Network, Simon & Schuster publishers, and a number of local broadcast TV and radio stations in the U.S.","CBS","industry_1","media"
FALSE,FALSE,"CBRE GROUP, INC. (CBRE)","Cbre Group, Inc.","CBRE Group is a commercial real estate services and investment firm with operations in major metropolitan areas throughout the world. The Company offers a full range of services to occupiers, owners, lenders and investors in office, retail, industrial, multifamily and other types of commercial real estate.","CBRE","industry_1","real estate"
FALSE,FALSE,"CBOE HOLDINGS, INC. (CBOE)","Cboe Holdings, Inc.","CBOE operates exchanges for trading options on various market indexes and futures contracts, such as options on the stocks of individual corporations or exchange-traded funds.","CBOE","industry_1","business services"
TRUE,FALSE,"COOPER INDUSTRIES PLC (CBE)","Cooper Industries Plc","Acquired by Eaton Corporation in 2012, Cooper manufactured and sold electrical and circuit protection products, and hand tools, power tools, and automated assembly systems.","CBE","industry_1","equipment"
TRUE,FALSE,"CHUBB CORP (CB)","Chubb Corp","Acquired by ACE Limited in 2015, the legacy Chubb Corp was a holding company for a family of property and casualty insurance companies known informally as the Chubb Group of Insurance Companies","CB.ACQ","industry_1","financial company"
FALSE,FALSE,"CHUBB LIMITED (CB)","Chubb Limited","Chubb Limited is a global commercial, property, and casualty insurance and reinsurance provider.","CB","industry_1","financial company"
FALSE,FALSE,"CATERPILLAR INC. (CAT)","Caterpillar Inc.","Caterpillar is a manufacturer of construction and mining equipment, diesel and natural gas engines, industrial gas turbines and diesel-electric locomotives. The company also provides financing and related services.","CAT","industry_1","equipment"
TRUE,FALSE,"CAMERON INTERNATIONAL CORPORATION (CAM)","Cameron International Corporation","Acquired by Schlumberger in 2016, Cameron International provided flow equipment and services to the oil and gas industry.","CAM","industry_1","engineering and construction"
FALSE,FALSE,"CARDINAL HEALTH, INC. (CAH)","Cardinal Health, Inc.","Cardinal Health provides medical products and pharmaceuticals to hospitals, pharmacies, clinics laboratories and physician offices worldwide.","CAH","industry_1","health care"
FALSE,FALSE,"CONAGRA FOODS, INC. (CAG)","Conagra Foods, Inc.","ConAgra Foods is a packaged food company with brands such as Marie Callender's, Healthy Choice, Slim Jim, Hebrew National, Reddi-wip, and Egg Beaters. ConAgra Foods also supplies frozen potato and sweet potato products as well as other vegetable, spice, and grain products to restaurant, foodservice operator, and commercial customers.","CAG","industry_1","consumer goods"
FALSE,FALSE,"CA, INC. (CA)","Ca, Inc.","CA provides software solutions enabling customers to plan, develop, manage and secure applications and enterprise environments across distributed, cloud, mobile and mainframe platforms.","CA","industry_1","IT services"
FALSE,FALSE,"CITIGROUP INC (C)","Citigroup Inc","Citigroup is a global diversified financial services holding company, whose businesses provide consumers, corporations, governments and institutions with a broad range of financial products and services, including consumer banking and credit, corporate and investment banking, securities brokerage, trade and securities services and wealth management. Citigroup has approximately 200 million customer accounts and does business in more than 1","C","industry_1","banking"
FALSE,FALSE,"BOSTON PROPERTIES, INC. (BXP)","Boston Properties, Inc.","Boston Properties is a self-administered and self-managed real estate investment trust (REIT) that owns and develops office properties in the U.S. Company properties are concentrated in Boston, Washington, DC, midtown Manhattan, San Francisco and Princeton, NJ.","BXP","industry_1","real estate"
FALSE,FALSE,"BORGWARNER INC. (BWA)","Borgwarner Inc.","BorgWarner is a worldwide manufacturer of automotive powertrain systems and components primarily for passenger cars, sport-utility vehicles, vans and light trucks, as well as commercial and off-highway vehicles.","BWA","industry_1","manufacturing"
TRUE,FALSE,"ANHEUSER-BUSCH COMPANIES, INC (BUD)","Anheuser-Busch Companies, Inc","Acquired by InBev N.V./ S.A. in 2008,  Anheuser-Busch was a beer brewer with origins dating back to 1875.","BUD","industry_1","consumer goods"
FALSE,TRUE,"PEABODY ENERGY CORPORATION (BTU)","Peabody Energy Corporation","Peabody Energy is a coal mining, marketing, and trading company in the U.S. and Australia.","BTU","industry_1","materials"
