"acquired","bankruptcy","company","company_name","description","ticker","industry_n","industry"
FALSE,FALSE,"AGILENT TECHNOLOGIES, INC. (A)","Agilent Technologies, Inc.","Agilent Technologies provides bio-analytical and electronic measurement solutions to the communications, electronics, life sciences and chemical analysis industries.","A","industry_1","hardware"
FALSE,FALSE,"AMERICAN SUPERCONDUCTOR CORPORATION (AMSC)","American Superconductor Corporation","American Superconductor provides power electronics for wind turbines and power grids.","AMSC","industry_1","equipment"
FALSE,FALSE,"AMERIPRISE FINANCIAL, INC. (AMP)","Ameriprise Financial, Inc.","Ameriprise provides financial planning, annuities, wealth, and asset management services.","AMP","industry_1","asset management"
FALSE,FALSE,"AMGEN INC. (AMGN)","Amgen Inc.","Amgen develops, manufactures and markets medicines for serious illnesses.","AMGN","industry_1","health care"
FALSE,FALSE,"AFFILIATED MANAGERS GROUP, INC. (AMG)","Affiliated Managers Group, Inc.","Affiliated Managers Group is a global asset management company with equity investments in boutique investment management firms, which maintain operational autonomy, and receive assistance from the company in marketing and distribution.","AMG","industry_1","asset management"
FALSE,FALSE,"AMETEK, INC. (AME)","Ametek, Inc.","AMETEK makes electronic instruments and electromechanical devices for the aerospace and defense, medical, mass transit, petrochemical, power and other industrial markets.","AME","industry_1","equipment"
FALSE,FALSE,"ADVANCED MICRO DEVICES, INC. (AMD)","Advanced Micro Devices, Inc.","AMD is a semiconductor company that primarily offers x86 microprocessors as standalone central processing units (CPU) or incorporated into accelerated processing units (APU), chipsets and discrete graphics processing units (GPUs) for the consumer, commercial and professional graphics markets.","AMD","industry_1","hardware"
FALSE,FALSE,"AMC NETWORKS INC. (AMCX)","Amc Networks Inc.","AMC Networks owns and operates TV programming channels including AMC, WE tv, BBC AMERICA, IFC and Sundance, in the U.S. and internationally.","AMCX","industry_1","media"
FALSE,TRUE,"AMBAC FINANCIAL GROUP, INC. (AMBC)","Ambac Financial Group, Inc.","Ambac provides financial guarantees, such as credit derivative contracts, and other financial services to clients in the public and private sectors.","AMBC","industry_1","financial company"
FALSE,FALSE,"APPLIED MATERIALS, INC. (AMAT)","Applied Materials, Inc.","Applied provides manufacturing equipment, services and software to the semiconductor, display, and solar photovoltaic industries.","AMAT","industry_1","equipment"
FALSE,FALSE,"ALEXION PHARMACEUTICALS, INC. (ALXN)","Alexion Pharmaceuticals, Inc.","Alexion is a pharmaceutical company focused on ultra-rare life-threatening genetic disorders. Company products include Soliris, a therapeutic approved for paroxysmal nocturnal hemoglobinuria (PNH) and for atypical hemolytic uremic syndrome (aHUS); Strensiq for the treatment of Hypophosphatasia (HPP); and Kanuma for the treatment of Lysosomal Acid Lipase Deficiency (LAL-D).","ALXN","industry_1","pharmaceuticals"
TRUE,FALSE,"ALTERA CORPORATION (ALTR)","Altera Corporation","Acquired by Intel in 2015, Altera was a global semiconductor company providing field-programmable gate array (FPGA) products to the telecom, wireless, industrial automation, military, auto, and other markets.","ALTR","industry_1","hardware"
FALSE,FALSE,"ALLEGION PLC (ALLE)","Allegion Plc","Allegion offers mechanical and electronic security products, such as steel doors and door frames, electronic and biometric access control systems, locks and key systems. Company brands include Falcon, LCN, Kryptonite, and Schlage.","ALLE","industry_1","consumer goods"
FALSE,FALSE,"THE ALLSTATE CORPORATION (ALL)","The Allstate Corporation","Allstate provides property-liability and life insurance in the U.S. and Canada.","ALL","industry_1","financial company"
FALSE,FALSE,"ALASKA AIR GROUP, INC. (ALK)","Alaska Air Group, Inc.","The company operates Alaska Airlines and Horizon Air, serving a route network spanning North America.","ALK","industry_1","transportation"
FALSE,FALSE,"ALIGN TECHNOLOGY, INC (ALGN)","Align Technology, Inc","Align designs, manufactures and markets the Invisalign System for tooth alignment therapy. The company also makes iTero oral scanners, and provides computer-aided design and manufacturing digital services used in dentistry, orthodontics, and dental records storage.","ALGN","industry_1","medical devices"
FALSE,FALSE,"ZOETIS INC. (ZTS)","Zoetis Inc.","Zoetis developes, manufactures and commercializes animal medicines and vaccines. The company had been a business unit of Pfizer for more than 60 years, prior to becoming an independent public company in 2013.","ZTS","industry_1","pharmaceuticals"
FALSE,FALSE,"ZIONS BANCORPORATION (ZION)","Zions Bancorporation","Zions provides community banking services, including business banking, commercial and residential development, construction and term lending, retail banking, residential mortgage servicing and lending, and trust and wealth management. The company operates primarily in the West and Southwest of the U.S.","ZION","industry_1","banking"
FALSE,FALSE,"ZIMMER BIOMET HOLDINGS, INC. (ZBH)","Zimmer Biomet Holdings, Inc.","Zimmer Biomet designs, manufactures and markets orthopaedic reconstructive products; sports medicine, biologics, extremities and trauma products; spine, bone healing, craniomaxillofacial and thoracic products; dental implants; and related surgical products.","ZBH","industry_1","health care"
FALSE,FALSE,"YUM! BRANDS, INC. (YUM)","Yum! Brands, Inc.","YUM develops, operates, franchises and licenses KFC, Pizza Hut and Taco Bell restaurants worldwide.","YUM","industry_1","consumer services"
TRUE,FALSE,"YAHOO! INC. (YHOO)","Yahoo! Inc.","Acquired by Verizon, Yahoo! generates revenue from display and search advertising on Yahoo! online properties and third-party websites.","YHOO","industry_1","internet"
FALSE,FALSE,"XYLEM INC. (XYL)","Xylem Inc.","Xylem designs and manufactures equipment, and provides services, for water and wastewater applications, such as filtration and treatment.","XYL","industry_1","engineering and construction"
TRUE,FALSE,"XTO ENERGY INC (XTO)","Xto Energy Inc","Acquired by Exxon Mobil in 2009, XTO Energy was engaged in exploration, development, and exploitation of oil and gas properties, and in the production, processing, marketing and transportation of oil and gas.","XTO","industry_1","energy"
FALSE,FALSE,"XEROX CORPORATION (XRX)","Xerox Corporation","Xerox primarily provides business process outsourcing services, including customer care, transaction processing, finance and accounting, and human resources, and document outsourcing services, such as workflow automation and centralized print services.","XRX","industry_1","business services"
FALSE,FALSE,"DENTSPLY SIRONA INC. (XRAY)","Dentsply Sirona Inc.","DENTSPLY designs, manufactures and markets consumable dental products for the professional dental market around the world.","XRAY","industry_1","health care"
FALSE,FALSE,"EXXON MOBIL CORPORATION (XOM)","Exxon Mobil Corporation","Exxon Mobil explores for and produces crude oil and natural gas,  and manufactures and markets petroleum products and commodity petrochemicals.","XOM","industry_1","energy"
FALSE,FALSE,"XILINX, INC. (XLNX)","Xilinx, Inc.","Xilinx designs and develops programmable integrated circuits.","XLNX","industry_1","hardware"
TRUE,FALSE,"XL GROUP PLC (XL)","Xl Group Plc","XL Group provides property and casualty insurance and reinsurance to industrial, commercial and professional firms, insurance companies and other enterprises.","XL","industry_1","financial company"
FALSE,FALSE,"XCEL ENERGY INC. (XEL)","Xcel Energy Inc.","Xcel Energy is a holding company whose utility subsidiaries provide electricity and natural gas in Minnesota, Wisconsin, Colorado, Michigan, New Mexico, North and South Dakota, and Texas.","XEL","industry_1","utility"
FALSE,FALSE,"CIMAREX ENERGY CO. (XEC)","Cimarex Energy Co.","Cimarex Energy is an oil and gas exploration and production company, operating mainly in Oklahoma, Texas and New Mexico.","XEC","industry_1","energy"
FALSE,FALSE,"UNITED STATES STEEL CORPORATION (X)","United States Steel Corporation","U. S. Steel produces flat-rolled and tubular steel products from iron ore and coke, in North America and Europe.","X","industry_1","materials"
FALSE,FALSE,"WYNN RESORTS, LIMITED (WYNN)","Wynn Resorts, Limited","Wynn Resorts develops, owns and operates destination casino resorts that integrate hotel accommodations with dining outlets, premium retail, entertainment theaters and meeting complexes.","WYNN","industry_1","consumer services"
FALSE,FALSE,"WYNDHAM DESTINATIONS, INC. (WYND)","Wyndham Destinations, Inc.","Wyndham Destinations is a vacation ownership and exchange company with presence in over 100 countries.","WYND","industry_1","consumer services"
TRUE,FALSE,"WYETH (WYE)","Wyeth","Acquired by Pfizer in 2009, Wyeth engaged in the discovery, development, manufacture, distribution and sale of pharmaceutical, consumer healthcare, and animal health products.","WYE","industry_1","health care"
FALSE,FALSE,"WEYERHAEUSER COMPANY (WY)","Weyerhaeuser Company","Weyerhaeuser grows and harvests trees, and manufactures and sells building products, pulp and paper.","WY","industry_1","materials"
TRUE,FALSE,"WM. WRIGLEY JR. COMPANY (WWY)","Wm. Wrigley Jr. Company","Acquired by Mars, Incorporated in 2008, The Wm. Wrigley Jr. Company manufactured and marketed chewing gum and other confectionery products worldwide.","WWY","industry_1","consumer goods"
FALSE,FALSE,"THE WESTERN UNION COMPANY (WU)","The Western Union Company","Western Union provides global money movement and payment services, primarily consumer-to-consumer money transfers, as well as consumer-to-business bill payments. The company also provides foreign exchange and cross-border, cross-currency transaction services for businesses and individuals.","WU","industry_1","consumer services"
FALSE,FALSE,"WESTROCK COMPANY (WRK)","Westrock Company","WestRock manufactures containerboard and paperboard, and makes packaging solutions.","WRK","industry_1","manufacturing"
FALSE,FALSE,"WPX ENERGY, INC. (WPX)","Wpx Energy, Inc.","WPX is an oil and gas exploration and production company engaged in the exploitation of long-life unconventional properties in North Dakota and in the southwestern U.S..","WPX","industry_1","energy"
FALSE,FALSE,"WAL-MART STORES, INC. (WMT)","Wal-Mart Stores, Inc.","Wal-Mart operates retail stores, warehouse clubs and e-commerce websites around the world. The company strategy is to lead on price.","WMT","industry_1","retail"
FALSE,FALSE,"THE WILLIAMS COMPANIES, INC. (WMB)","The Williams Companies, Inc.","Williams is primarily a U.S. based operator of interstate gas pipelines, and provider of natural gas and natural gas liquids gathering, treatment, processing and compression services.","WMB","industry_1","energy"
FALSE,TRUE,"WASHINGTON MUTUAL, INC. (WM)","Washington Mutual, Inc.","Washington Mutual filed for bankruptcy in 2008. Prior to the bankruptcy, the company had been a consumer and small business banking company in the U.S.","WAMU","industry_1","banking"
FALSE,FALSE,"WASTE MANAGEMENT, INC. (WM)","Waste Management, Inc.","Waste Management provides waste collection, transfer, recycling and disposal services in North America. The company owns a number of landfill sites and landfill gas-to-energy facilities.","WM","industry_1","business services"
FALSE,FALSE,"WILLIS TOWERS WATSON PLC (WLTW)","Willis Towers Watson Plc","Willis Towers Watson provides property and liability insurance brokerage services, reinsurance, and employee benefits brokerage and consulting services.","WLTW","industry_1","business services"
FALSE,TRUE,"WINDSTREAM HOLDINGS, INC. (WINMQ)","Windstream Holdings, Inc.","Windstream provides broadband communications, voice and digital television to consumers in the U.S., as well as data, cloud solutions, unified communications and managed services to small business and enterprise clients.","WINMQ","industry_1","telecommunications"
FALSE,FALSE,"WINMARK CORPORATION (WINA)","Winmark Corporation","Winmark franchises value-oriented retail store concepts that buy, sell and trade used merchandise, such as used clothing and accessories, toys, sporting goods, or musical instruments, in the U.S. and Canada.","WINA","industry_1","retail"
FALSE,FALSE,"WHIRLPOOL CORPORATION (WHR)","Whirlpool Corporation","Whirlpool manufactures and markets major home appliances, such as refrigerators, cooking stoves, dishwashers, and 
laundry machines under brand names such as Whirlpool, KitchenAid, and Maytag.","WHR","industry_1","consumer goods"
FALSE,FALSE,"WEATHERFORD INTERNATIONAL PUBLIC LIMITED COMPANY (WFT)","Weatherford International Public Limited Company","Weatherford provides equipment and services used in the drilling, evaluation, completion, production and intervention of oil and gas wells.","WFT","industry_1","engineering and construction"
TRUE,FALSE,"WHOLE FOODS MARKET, INC. (WFM)","Whole Foods Market, Inc.","Acquired by Amazon in 2017, Whole Foods operated natural and organic foods supermarkets in the U.S., Canada, and the U.K.","WFM","industry_1","retail"
FALSE,FALSE,"WELLS FARGO & COMPANY (WFC)","Wells Fargo & Company","Wells Fargo provides retail, commercial and corporate banking across the U.S., as well as wholesale banking, mortgage banking, equipment leasing, securities brokerage, investment banking, and other financial services.","WFC","industry_1","banking"
FALSE,FALSE,"THE WENDY'S COMPANY (WEN)","The Wendy'S Company","Wendy’s owns and franchises Wendy’s restaurants in the U.S..","WEN","industry_1","consumer services"
FALSE,FALSE,"WELLTOWER INC. (WELL)","Welltower Inc.","Welltower is a real estate investment trust (REIT) that owns properties in the U.S., Canada and the U.K., consisting of seniors housing and post-acute communities and outpatient medical facilities.","WELL","industry_1","health care"
FALSE,FALSE,"WEC ENERGY GROUP, INC. (WEC)","Wec Energy Group, Inc.","WEC Energy Group is a holding company, whose subsidiaries provide regulated natural gas and electricity, as well as nonregulated renewable energy primarily in Wisconsin, Illinois, and other Midwestern states of the U.S.","WEC","industry_1","utility"
FALSE,FALSE,"WADDELL & REED FINANCIAL, INC. (WDR)","Waddell & Reed Financial, Inc.","Waddell & Reed provides investment management, advisory, underwriting and distribution for mutual funds and institutional and separately managed accounts.","WDR","industry_1","asset management"
FALSE,FALSE,"WESTERN DIGITAL CORPORATION (WDC)","Western Digital Corporation","Western Digital makes data storage solutions such as hard disk drives and solid-state drives","WDC","industry_1","hardware"
FALSE,FALSE,"WALGREENS BOOTS ALLIANCE, INC. (WBA)","Walgreens Boots Alliance, Inc.","Walgreens Boots Alliance operates retail pharmacies across the U.S. and Europe under brands including Walgreens, Duane Reade, Boots and Alliance Healthcare. The company also operates a global pharmaceutical wholesale and distribution network, and a portfolio of","WBA","industry_1","health care"
TRUE,FALSE,"WACHOVIA CORPORATION (WB)","Wachovia Corporation","Acquired by Wells Fargo in 2008, Wachovia provided commercial and retail banking and trust services.","WB","industry_1","banking"
FALSE,FALSE,"WATERS CORPORATION (WAT)","Waters Corporation","Waters designs, manufactures, sells and services liquid chromatography, mass spectrometry, thermal analysis, rheometry and calorimetry analytical instruments, related software, and consumables. These products are used by life sciences, biochemical, industrial, nutritional safety, environmental, academic and governmental customers.","WAT","industry_1","equipment"
TRUE,FALSE,"WALGREEN CO (WAG)","Walgreen Co","Prior to its merger with Alliance Boots in 2014, Walgreen primarily operated drugstores and specialty pharmacies in the U.S.","WAG","industry_1","retail"
FALSE,FALSE,"VERIZON COMMUNICATIONS INC. (VZ)","Verizon Communications Inc.","Verizon provides wireless voice and data communications, wireline broadband video and data for consumers in the U.S. The company offers corporate networking solutions, data center and cloud services to business and government customers in the U.S. and abroad.","VZ","industry_1","telecommunications"
FALSE,FALSE,"VENTAS INC (VTR)","Ventas Inc","Ventas is a real estate investment trust (REIT) that owns a portfolio of seniors housing and healthcare properties located in the U.S., Canada and the U.K.","VTR","industry_1","health care"
FALSE,FALSE,"VERTEX PHARMACEUTICALS INCORPORATED (VRTX)","Vertex Pharmaceuticals Incorporated","Vertex Pharmaceuticals discovers, develops, manufactures and commercializes therapies for the treatment of cystic fibrosis, including ORKAMBI and KALYDECO.","VRTX","industry_1","pharmaceuticals"
FALSE,FALSE,"VERISIGN, INC. (VRSN)","Verisign, Inc.","VeriSign provides Internet domain name registry and Internet security services.","VRSN","industry_1","IT services"
FALSE,FALSE,"VERISK ANALYTICS, INC. (VRSK)","Verisk Analytics, Inc.","Verisk Analytics provides data analytics services to insurance, natural resources, healthcare, financial services, government, and risk management customers. The company collects and analyzes billions of data records to provide decision making information integrated into customer workflows.","VRSK","industry_1","IT services"
FALSE,FALSE,"VORNADO REALTY TRUST (VNO)","Vornado Realty Trust","Vornado is a real estate investment trust (REIT) that owns office space and residential properties, primarily in New York City and Washington D.C.","VNO","industry_1","real estate"
FALSE,FALSE,"VULCAN MATERIALS COMPANY (VMC)","Vulcan Materials Company","Vulcan is a U.S. based producer of crushed stone, sand and gravel used in construction, and of asphalt mix and ready-mixed concrete.","VMC","industry_1","materials"
FALSE,FALSE,"VALERO ENERGY CORPORATION (VLO)","Valero Energy Corporation","Valero operates petroleum refineries in the U.S., Canada, and the U.K., and markets refined products through Valero-branded gas stations and on a wholesale basis. The company also operates ethanol plants in the central plains region of the U.S.","VLO","industry_1","energy"
FALSE,FALSE,"MERIDIAN BIOSCIENCE, INC. (VIVO)","Meridian Bioscience, Inc.","Meridian develops, manufactures, sells and distributes disease diagnostic test kits, bulk antigens, antibodies, and bioresearch reagents, and performs contract development and manufacture of proteins and other biologicals for use by biopharmaceutical and biotechnology companies engaged in research for new drugs and vaccines.","VIVO","industry_1","health care"
FALSE,FALSE,"VIAVI SOLUTIONS INC. (VIAV)","Viavi Solutions Inc.","Viavi, formerly JDS Uniphase Corporation, is a provider of network equipment and optical products for telecommunications service providers, equipment manufacturers and enterprises. The company also provides anti-counterfeiting solutions for currency authentication, and optical instruments for security, safety, and other applications.","VIAV","industry_1","hardware"
FALSE,FALSE,"VIACOM, INC. (VIA)","Viacom, Inc.","Viacom creates TV programs, films, entertainment applications, games, and consumer products. Company media brands include Nickelodeon, Comedy Central, BET, and Paramount Pictures.","VIA","industry_1","media"
FALSE,FALSE,"VARIAN MEDICAL SYSTEMS INC (VAR)","Varian Medical Systems Inc","Varian Medical Systems makes medical devices and software for treating cancer and other conditions with radiotherapy, radiosurgery, proton therapy and brachytherapy. The company also makes X-ray imaging components for medical, scientific, cargo screening, and industrial applications.","VAR","industry_1","equipment"
FALSE,FALSE,"U.S. BANCORP (USB)","U.S. Bancorp","U.S. Bancorp is a bank holding company that provides lending and depository services, cash management, capital markets, trust and investment management, as well as credit card services, merchant and ATM processing, mortgage banking, insurance, brokerage and leasing.","USB","industry_1","banking"
FALSE,FALSE,"UNITED RENTALS, INC. (URI)","United Rentals, Inc.","The company rents construction and industrial equipment, aerial work platforms, trench safety equipment, power and HVAC equipment, pumps, and general tools and light equipment in the U.S. and Canada.","URI","industry_1","engineering and construction"
FALSE,FALSE,"VISA INC. (V)","Visa Inc.","Visa is a global payments technology company that operates a payment processing network, which facilitates authorization, clearing and settlement of payment transactions, and provides fraud protection for account holders. Visa does not issue cards, extend credit or set rates for account holders. In most cases, account holder and merchant relationships are managed by Visa's financial institution clients.","V","industry_1","business services"
TRUE,FALSE,"UST INC. (UST)","Ust Inc.","Acquired by Altria Group in 2008, UST was engaged in manufacturing and marketing of smokeless tobacco products and wine.","UST","industry_1","consumer goods"
FALSE,FALSE,"URBAN OUTFITTERS, INC. (URBN)","Urban Outfitters, Inc.","Urban Outfitters is a retail and wholesale apparel, accessories, and home goods company, operating under the Urban Outfitters, Anthropologie, Free People, Terrain and Bhldn brands. Company retails stores are primarily located in the U.S., Canada, and Western Europe.","URBN","industry_1","retail"
FALSE,FALSE,"UNITED TECHNOLOGIES CORPORATION (UTX)","United Technologies Corporation","United Technologies is a diversified technology company. Its products include Otis elevators and escalators; building heating, ventilating, air conditioning and refrigeration systems; Pratt & Whitney aircraft engines and other aerospace products and services sold to aircraft manufacturers, airlines and governments.","UTX","industry_1","conglomerate"
FALSE,FALSE,"UNITED PARCEL SERVICE, INC. (UPS)","United Parcel Service, Inc.","United Parcel Service is a package delivery company that was founded in 1907. The company delivers packages in over 200 countries and provides logistics services, such as distribution, customs brokerage and insurance.","UPS","industry_1","transportation"
FALSE,FALSE,"V.F. CORPORATION (VFC)","V.F. Corporation","VF designs, produces, markets and distributes branded apparel and footwear. Company brands include The North Face, Vans, Timberland, Wrangler, Lee, Nautica, Majestic and Kipling.","VFC","industry_1","consumer goods"
FALSE,FALSE,"UNION PACIFIC CORPORATION (UNP)","Union Pacific Corporation","Union Pacific provides railroad transportation in the western two-thirds of the U.S., primarily transporting agricultural, automotive, chemical, and industrial products and coal.","UNP","industry_1","transportation"
FALSE,FALSE,"UNUM GROUP (UNM)","Unum Group","Unum provides life and disability insurance in the U.S. and the U.K.","UNM","industry_1","financial company"
FALSE,FALSE,"UNITEDHEALTH GROUP INCORPORATED (UNH)","Unitedhealth Group Incorporated","UnitedHealth provides employer, individual, Medicare, and other health insurance plans.","UNH","industry_1","health care"
FALSE,FALSE,"ULTA SALON, COSMETICS & FRAGRANCE, INC. (ULTA)","Ulta Salon, Cosmetics & Fragrance, Inc.","Ulta Beauty is a beauty retailer in the U.S. that offers cosmetics, fragrances, skin and hair care products, and salon services.","ULTA","industry_1","retail"
FALSE,FALSE,"UNISYS CORPORATION (UIS)","Unisys Corporation","Unisys provides information technology services to enterprises and governments. Offerngs include cloud and IT infrastructure, application services, security solutions and server technology.","UIS","industry_1","IT services"
FALSE,FALSE,"UNIVERSAL HEALTH SERVICES, INC. (UHS)","Universal Health Services, Inc.","The company owns and operates acute care hospitals, behavioral health centers, surgical hospitals, ambulatory surgery centers and radiation oncology centers, primarily in the U.S. and the U.K.","UHS","industry_1","health care"
FALSE,FALSE,"UNITED-GUARDIAN, INC. (UG)","United-Guardian, Inc.","United-Guardian manufactures and markets cosmetic ingredients, personal care and health care products, pharmaceuticals, medical lubricants, and specialty industrial products.","UG","industry_1","health care"
FALSE,FALSE,"UDR, INC. (UDR)","Udr, Inc.","UDR is a real estate investment trust (REIT) that develops, owns, and operates multifamily apartment communities throughout the U.S.","UDR","industry_1","real estate"
FALSE,TRUE,"UNITED CONTINENTAL HOLDINGS, INC. (UAL)","United Continental Holdings, Inc.","The company is a holding company parent of United Airlines, transporting people and cargo through a global route network with hubs at Newark Liberty, Chicago O’Hare, Denver, George Bush Houston, Los Angeles, A.B. Won Pat Guam, San Francisco and Washington Dulles International airports.","UAL","industry_1","transportation"
FALSE,FALSE,"UNDER ARMOUR, INC. (UA)","Under Armour, Inc.","Under Armour developes, markets and distributes branded athletic apparel, footwear and accessories. The company primarily sells its products on a wholesale basis to retailers.","UA","industry_1","consumer goods"
TRUE,FALSE,"TYCO INTERNATIONAL PLC (TYC)","Tyco International Plc","Acquired by Johnson Controls in 2016, Tyco provided security products and services, fire detection and suppression products, and life safety products.","TYC","industry_1","manufacturing"
